{
  "schemaVersion": 1,
  "manifestId": "vayada-release/v1/1111111111111111111111111111111111111111/41001/2",
  "manifestSha256": "d4b12732362a7022b5d9778b0cecf8308c3a183f7c626da0574fb52edd5741d6",
  "candidateArtifactId": 90210,
  "candidateArtifactName": "next-release-candidate-v1-41001-2",
  "producer": {
    "repository": "vayada-marketplace/vayada",
    "workflowName": "Build coordinated next release",
    "workflowPath": ".github/workflows/build-coordinated-release.yml",
    "runId": 41001,
    "runAttempt": 2
  },
  "publisher": {
    "repository": "vayada-marketplace/vayada",
    "workflowName": "Publish coordinated next release",
    "workflowPath": ".github/workflows/publish-coordinated-release.yml",
    "runId": 42001,
    "runAttempt": 1
  },
  "publishedArtifactName": "next-release-published-v1-1111111111111111111111111111111111111111-41001-2",
  "publishedAt": "2026-09-17T06:00:00.000Z",
  "expiresAt": "2026-12-16T06:00:00.000Z",
  "retentionDays": 90,
  "idempotencyKey": "vayada-release/v1/1111111111111111111111111111111111111111/41001/2"
}
